"Rank","NCT Number","Title","Acronym","Status","Study Results","Conditions","Interventions","Outcome Measures","Sponsor/Collaborators","Gender","Age","Phases","Enrollment","Funded Bys","Study Type","Study Designs","Other IDs","Start Date","Primary Completion Date","Completion Date","First Posted","Results First Posted","Last Update Posted","Locations","Study Documents","URL"
58,"NCT04366089","Oxygen-Ozone as Adjuvant Treatment in Early Control of COVID-19 Progression and Modulation of the Gut Microbial Flora","PROBIOZOVID","Recruiting","No Results Available","COVID|SARS-CoV 2|Pneumonia, Viral|Coronavirus Infection","Other: Oxygen-ozone therapy, probiotic supplementation and Standard of care|Dietary Supplement: SivoMixx (200 billion)|Drug: Azithromycin|Drug: hydroxychloroquine","Delta in the number of patients requiring orotracheal intubation despite treatment|Delta of crude mortality|Delta of length of stay for patients in hospital|delta in the value of interleukin (IL)-1|delta in the value of IL-6|delta in the value of IL-10|delta in the value of Tumor Necrosis Factor (TNF)-alpha|delta in the value of cluster of differentiation (CD)4+ CD38/ Human Leukocyte Antigen-DR isotype (HLA-DR)|delta in the value of CD8+ CD38/ HLA-DR|delta in the value of fecal calprotectin|delta in the value of lipopolysaccharide (LPS)|delta in the value of zonulin|delta in the value of alpha1-antitrypsin","Roberto Poscia MD, PhD|Azienda Policlinico Umberto I","All","18 Years and older   (Adult, Older Adult)","Phase 2","152","Other","Interventional","Allocation: Randomized|Intervention Model: Parallel Assignment|Masking: Single (Outcomes Assessor)|Primary Purpose: Treatment","110/2020","March 26, 2020","October 30, 2020","December 31, 2020","April 28, 2020",,"April 28, 2020","Francesco Pugliese, Rome, RM, Italy",,"https://ClinicalTrials.gov/show/NCT04366089"
59,"NCT04343092","Efficacy of Ivermectin as Add on Therapy in COVID19 Patients",,"Completed","No Results Available","COVID 19","Drug: Ivermectin (IVM)","Number of cured patients|Mean time to cure of the covid 19 patients","University of Baghdad","All","18 Years and older   (Adult, Older Adult)","Phase 1","100","Other","Interventional","Allocation: Randomized|Intervention Model: Parallel Assignment|Masking: Double (Participant, Investigator)|Primary Purpose: Treatment","PRO20040001","April 18, 2020","May 31, 2020","June 1, 2020","April 13, 2020",,"June 5, 2020","General Directorate of Medical City, Bagdad, Baghdad, Iraq",,"https://ClinicalTrials.gov/show/NCT04343092"
60,"NCT04365582","OUTpatient Treatment of COVID-19 in Patients With Risk Factor for Poor Outcome","OUTCOV","Not yet recruiting","No Results Available","COVID","Drug: Azithromycin|Drug: Hydroxychloroquine|Drug: Lopinavir 200Mg/Ritonavir 50Mg Tab","Hospital admission|Effect of treatment on Death at D20|Effect of treatment on Death at D60|Effect of treatment on Death due to COVID at D20|Effect of treatment on Death due to COVID at D60|Effect of treatment on need for ICU stay at D20|Effect of treatment on need for ICU stay at D60|Effect of treatment on duration of ICU stay at D20|Effect of treatment on duration of ICU stay at D60|Effect of treatment on need of mechanical ventilation at D20|Effect of treatment on need of mechanical ventilation at D60|Effect of treatment on duration of mechanical ventilation at D20|Effect of treatment on duration of mechanical ventilation at D60|Effect of treatment on time to hospitalization at D20|Effect of treatment on time to hospitalization at D60|Effect of treatment on Duration of Hospital stay et D20|Effect of treatment on Duration of Hospital stay et D60|Effect of treatment on Duration of symptoms at D20|Effect of treatment on Duration of symptoms at D60|Incidence of Treatment-Emergent Adverse Events","Groupe Hospitalier Paris Saint Joseph","All","50 Years and older   (Adult, Older Adult)","Phase 3","640","Other","Interventional","Allocation: Randomized|Intervention Model: Parallel Assignment|Masking: None (Open Label)|Primary Purpose: Treatment","OUTCOV","April 28, 2020","July 28, 2020","January 28, 2021","April 28, 2020",,"April 28, 2020","Hôpital Privé d'Antony, Antony, France|Hôpital Avicenne, Bobigny, France|Centre Hospitalier Intercommunal de Créteil, Créteil, France|Groupe Hospitalier Paris Saint-Joseph, Paris, France|Institut Mutualiste Montsouris, Paris, France",,"https://ClinicalTrials.gov/show/NCT04365582"
61,"NCT04398004","Anti-inflammatory Clarithromycin for Improving COVID-19 Infection Early","ACHIEVE","Recruiting","No Results Available","COVID-19|Virus Diseases|Corona Virus Infection","Drug: Clarithromycin","Clinical outcome negative for two parameters(hospital admission/disease progression)|At least 50% change of the score of respiratory symptoms from the baseline|Comparison of two parameters with historical comparators from Hellenic Sepsis Study Group Database|Comparison of the score of respiratory symptoms with historical comparators from Hellenic Sepsis Study Group Database|Clinical outcome negative for two parameters(hospital admission/disease progression) on day 4|At least 50% change of the score of respiratory symptoms from the baseline on day 4|Range of development of severe respiratory failure|Range of hospital readmission until day 14|Change of viral load in respiratory secretions from baseline on day 8|Change of function of monocytes at days 1 and 8|Change of function of Th1 cells at days 1 and 8|Change of function of Th2 cells at days 1 and 8|Change of serum interleukin-6 (IL-6) cytokine levels between days 1 and 8|Change of serum interleukin-8 (IL-8) cytokine levels between days 1 and 8|Change of serum human beta defensin-2 (hBD-2) between days 1 and 8|Change of cytokine levels interleukin-6 (IL-6) at the rhinopharynx between days 1,4 and 8|Change of interleukin-1 (IL-1) cytokine levels at the rhinopharynx between days 1,4 and 8|Change of the IL-10/TNFα ratio between days 1 and 8","Hellenic Institute for the Study of Sepsis","All","18 Years and older   (Adult, Older Adult)","Phase 2","90","Other","Interventional","Allocation: N/A|Intervention Model: Single Group Assignment|Masking: None (Open Label)|Primary Purpose: Prevention","ACHIEVE|2020-001882-36","May 6, 2020","May 6, 2022","May 6, 2022","May 21, 2020",,"May 26, 2020","COVID-19 Department, General Hospital of Attica SISMANOGLEIO-AMALIA FLEMING, Marousi, Athens, Greece|2nd Department of Internal Medicine, General Hospital of Nikaia, Piraeus, Attica, Greece|2nd Department of Internal Medicine, University General Hospital of Alexandroupolis, Alexandroupolis, Greece|1st University Department of Internal Medicine, LAIKO General Hospital of Athens, Athens, Greece|2nd University Department of Internal Medicine, IPPOKRATEION General Hospital of Athens, Athens, Greece|3rd University Department of Internal Medicine, General Hospital of Chest Diseases of Athens I SOTIRIA, Athens, Greece|1st Department of Internal Medicine, General University Hospital of Ioannina, Ioánnina, Greece|2nd Department of Internal Medicine, General Hospital of Piraeus ""Tzaneio"", Piraeus, Greece|1st Department of Internal Medicine, AHEPA University General Hospital of Thessaloniki, Thessaloníki, Greece",,"https://ClinicalTrials.gov/show/NCT04398004"
62,"NCT04323345","Efficacy of Natural Honey Treatment in Patients With Novel Coronavirus",,"Recruiting","No Results Available","COVID-19","Dietary Supplement: Natural Honey|Other: Standard Care","Rate of recovery from positive to negative swaps|Fever to normal temperature in days|Resolution of lung inflammation in CT or X ray|30 days mortality rate|Number of days till reaching negative swab results","Misr University for Science and Technology","All","5 Years to 75 Years   (Child, Adult, Older Adult)","Phase 3","1000","Other","Interventional","Allocation: Randomized|Intervention Model: Parallel Assignment|Masking: Single (Investigator)|Primary Purpose: Treatment","MUST23032020","April 15, 2020","December 15, 2020","January 15, 2021","March 26, 2020",,"April 21, 2020","Mahmoud Tantawy, Cairo, Egypt",,"https://ClinicalTrials.gov/show/NCT04323345"
63,"NCT04365764","Effect of Treatments in Patients Hospitalized for Severe COVID-19 Pneumonia: a Multicenter Cohort Study",,"Recruiting","No Results Available","Covid-19|ARDS|Pneumonia",,"Composite of death and mechanical ventilation|Death|Mechanical ventilation|World Health Organization score","Groupe Hospitalier Pitie-Salpetriere|Centre Hospitalier Intercommunal Robert Ballanger|Centre Hospitalier Intercommunal Montfermeil-Le Raincy|CMC Ambroise Paré","All","Child, Adult, Older Adult",,"400","Other","Observational","Observational Model: Case-Control|Time Perspective: Cross-Sectional","CIC1421-20-06","March 14, 2020","May 31, 2020","December 31, 2020","April 28, 2020",,"May 20, 2020","Centre Hospitalier Intercommunal Robert Ballanger, Aulnay-sous-Bois, France|Centre Hospitalier Intercommunal Le Raincy-Montfermeil, Montfermeil, France",,"https://ClinicalTrials.gov/show/NCT04365764"
64,"NCT04386447","Phase II RCT to Assess Efficacy of Intravenous Administration of Oxytocin in Patients Affected by COVID-19","OsCOVID19","Not yet recruiting","No Results Available","Covid-19|Corona Virus Infection|SARS-CoV 2","Drug: Oxytocin|Drug: Standard of Care","Proportion of cases who during 14 exhibit one of the following conditions|Mortality 28 days after randomization","Azienda Ospedaliero-Universitaria di Parma|University of Parma","All","18 Years and older   (Adult, Older Adult)","Phase 2","145","Other","Interventional","Allocation: Randomized|Intervention Model: Parallel Assignment|Masking: None (Open Label)|Primary Purpose: Treatment","OsCOVID19","June 3, 2020","October 31, 2020","December 31, 2020","May 13, 2020",,"May 19, 2020","CNRS, Lyon, France|Azienda Ospedaliero Universitaria di Parma, Parma, PR, Italy|Ospedale San Francesco, Nuoro, Italy",,"https://ClinicalTrials.gov/show/NCT04386447"
65,"NCT04366206","Factors Associated With Clinical Outcomes in Patients Hospitalized for Covid-19 in GHT-93 Est",,"Recruiting","No Results Available","COVID|SARS-CoV 2",,"Composite of death and mechanical ventilation|Need for mechanical ventilation|Death|Acute kidney injury|Acute respiratory distress syndrome|Cardiac arrhythmia and conduction disorder|60-days mortality|60-days mechanical ventilation","Centre Hospitalier Intercommunal Robert Ballanger|Groupe Hospitalier Pitie-Salpetriere","All","Child, Adult, Older Adult",,"143","Other","Observational","Observational Model: Cohort|Time Perspective: Prospective","GHTRB-2020-01","March 14, 2020","July 31, 2020","July 31, 2020","April 28, 2020",,"April 28, 2020","Centre Hospitalier Intercommunal Robert Ballanger, Aulnay-sous-Bois, France|Groupe Hospitalier Pitie Salpetriere, Paris, France",,"https://ClinicalTrials.gov/show/NCT04366206"
66,"NCT04361422","Isotretinoin in Treatment of COVID-19","Randomized","Not yet recruiting","No Results Available","COVID-19","Drug: Isotretinoin Only Product in Oral Dose Form","Clinical clearance","Tanta University","All","18 Years to 40 Years   (Adult)","Phase 3","300","Other","Interventional","Allocation: Randomized|Intervention Model: Parallel Assignment|Masking: None (Open Label)|Primary Purpose: Treatment","9469305c","April 21, 2020","June 2020","September 2020","April 24, 2020",,"April 24, 2020",,,"https://ClinicalTrials.gov/show/NCT04361422"
