"Rank","NCT Number","Title","Acronym","Status","Study Results","Conditions","Interventions","Outcome Measures","Sponsor/Collaborators","Gender","Age","Phases","Enrollment","Funded Bys","Study Type","Study Designs","Other IDs","Start Date","Primary Completion Date","Completion Date","First Posted","Results First Posted","Last Update Posted","Locations","Study Documents","URL"
37,"NCT04349592","Qatar Prospective RCT Of Therapy Eliminating Covid Transmission","Q-PROTECT","Not yet recruiting","No Results Available","Covid19","Drug: Hydroxychloroquine + Azithromycin|Drug: Hydroxychloroquine + Placebo|Other: Placebo + Placebo","Proportion of virologically cured (no virus detected) cases at day 6|The dichotomous virologic shedding endpoint as assessed at two weeks after study entry|Quantitative viral load (assessed with each virology testing set)","Hamad Medical Corporation","All","18 Years and older   (Adult, Older Adult)","Not Applicable","456","Industry","Interventional","Allocation: Randomized|Intervention Model: Parallel Assignment|Masking: Quadruple (Participant, Care Provider, Investigator, Outcomes Assessor)|Primary Purpose: Treatment","MRC-05-001","April 14, 2020","May 14, 2020","May 30, 2020","April 16, 2020",,"April 16, 2020",,,"https://ClinicalTrials.gov/show/NCT04349592"
38,"NCT04395768","International ALLIANCE Study of Therapies to Prevent Progression of COVID-19",,"Not yet recruiting","No Results Available","COVID19","Dietary Supplement: Vitamin C|Drug: Hydroxychloroquine|Drug: Azithromycin|Dietary Supplement: Zinc Citrate|Dietary Supplement: Vitamin D3|Dietary Supplement: Vitamin B12","Symptoms|Length of hospital stay|invasive mechanical ventilation or mortality|Mortality|mechanical ventilation|oxygen|ICU|days in hospital|days in ICU|renal replacement therapy|Extracorporeal support","National Institute of Integrative Medicine, Australia|Catholic Health Initiatives","All","18 Years and older   (Adult, Older Adult)","Phase 2","200","Other","Interventional","Allocation: Randomized|Intervention Model: Parallel Assignment|Masking: Double (Investigator, Outcomes Assessor)|Primary Purpose: Treatment","Alliance-COVID19","May 25, 2020","May 31, 2021","December 31, 2021","May 20, 2020",,"May 20, 2020",,,"https://ClinicalTrials.gov/show/NCT04395768"
39,"NCT04374019","Novel Agents for Treatment of High-risk COVID-19 Positive Patients",,"Recruiting","No Results Available","COVID|Sars-CoV2","Drug: Hydroxychloroquine|Drug: Hydroxychloroquine and Azithromycin|Drug: Hydroxychloroquine and Ivermectin|Drug: Camostat Mesilate","Clinical Deterioration|Change in Viral Load|Rate of Organ Failure|Progression to ICU Care or Ventilation|Change in Clinical Status|Mortality|Rate of severe adverse events|Oxygen-free days|Ventilator-free days|Vasopressor-free days|ICU-free days|Hospital-free days|Patients meeting Hy's Law criteria|Liver Function|Heart Function","Susanne Arnold|University of Kentucky","All","18 Years to 99 Years   (Adult, Older Adult)","Phase 2","240","Other","Interventional","Allocation: Randomized|Intervention Model: Parallel Assignment|Masking: None (Open Label)|Primary Purpose: Treatment","MCC-20-COVID-01-PMC","May 1, 2020","May 2021","May 2021","May 5, 2020",,"May 7, 2020","University of Kentucky Markey Cancer Center, Lexington, Kentucky, United States",,"https://ClinicalTrials.gov/show/NCT04374019"
40,"NCT04344444","Treatment in Patients With Suspected or Confirmed COVID-19 With Early Moderate or Severe Disease","RCT","Recruiting","No Results Available","COVID-19","Drug: Hydroxychloroquine|Drug: Azithromycin","Most severe outcome","LCMC Health","All","18 Years to 100 Years   (Adult, Older Adult)","Phase 3","600","Other","Interventional","Allocation: Randomized|Intervention Model: Parallel Assignment|Masking: None (Open Label)|Primary Purpose: Treatment","COVID 2020-001","April 10, 2020","April 10, 2021","December 10, 2021","April 14, 2020",,"April 14, 2020","University Medical Center New Orleans, New Orleans, Louisiana, United States",,"https://ClinicalTrials.gov/show/NCT04344444"
41,"NCT04383717","Levamisole and Isoprinosine in the Treatment of COVID19: A Proposed Therapeutic Trial",,"Not yet recruiting","No Results Available","Respiratory Tract Infections","Drug: Levamisole and isoprinosine|Drug: Azithromycin and hydroxychloroquine","COVID 19 induced fever in both groups|COVID 19 induced dyspnea in both groups|COVID 19 viral load in both groups|laboratory clearance in both groups: CRP in mg/dL","Cairo University","All","6 Years to 90 Years   (Child, Adult, Older Adult)","Phase 3","60","Other","Interventional","Allocation: Randomized|Intervention Model: Parallel Assignment|Masking: Triple (Participant, Care Provider, Investigator)|Primary Purpose: Treatment","Levamisole and isoprinosine","May 5, 2020","August 30, 2020","October 30, 2020","May 12, 2020",,"May 13, 2020",,,"https://ClinicalTrials.gov/show/NCT04383717"
42,"NCT04339816","Azithromycin Added to Hydrochloroquine in Patients Admitted to Intensive Care With COVID-19: Randomised Controlled Trial","AZIQUINE-ICU","Recruiting","No Results Available","COVID-19|Respiratory Failure","Drug: Azithromycin|Drug: Hydroxychloroquine|Drug: Placebo","Proportion of alive patients free off mechanical ventilation|Proportion of patients who avoided the need of mechanical ventilation|ICU LOS|Mortality28|Mortality90","Frantisek Duska, MD, PhD|Masaryk Hospital Usti nad Labem|University Hospital Pilsen|The Faculty Hospital Na Bulovce|St. Anne's University Hospital Brno, Czech Republic|University Hospital, Motol|General University Hospital, Prague|University Hospital Olomouc|Charles University, Czech Republic","All","18 Years and older   (Adult, Older Adult)","Phase 3","240","Other","Interventional","Allocation: Randomized|Intervention Model: Parallel Assignment|Masking: Triple (Participant, Care Provider, Outcomes Assessor)|Primary Purpose: Treatment","AZIQUINE-ICU-25032020|2020-001456-18","May 13, 2020","December 31, 2021","June 30, 2022","April 9, 2020",,"June 4, 2020","František Duška, Praha, Česká Republika, Czechia",,"https://ClinicalTrials.gov/show/NCT04339816"
43,"NCT04359095","Effectiveness and Safety of Medical Treatment for SARS-CoV-2 (COVID-19) in Colombia",,"Not yet recruiting","No Results Available","COVID-19","Drug: Hydroxychloroquine|Drug: Lopinavir / Ritonavir Pill|Drug: Azithromycin|Other: Standard treatment","Mortality|Number of Participants with Treatment Related Severe Adverse Events as Assessed by the NCORP Guidance for Collection of Adverse Events Related to COVID-19 Infection|Time to death|Number of Participants that are transferred to the Intensive Care Unit (ICU)|Number of Participants that need Mechanical Ventilation Support with endotracheal intubation.|Number of participants Cured assessed by Nasopharyngeal swab, oropharyngeal swab, and blood aspiration for COVID19 (RT-PCR) without clinical symptoms and normal chest X ray|Number of Participants with Any Adverse Event Related to Treatment Assessed by the NCORP Guidance for Collection of Adverse Events Related to COVID-19 Infection","Universidad Nacional de Colombia|Pontificia Universidad Javeriana|Clínica Universitaria Colombia|Hospital Universitario San Ignacio|Hospital Universitario Nacional de Colombia|Clínica Reina Sofía|Fundación Cardio Infantil|Hospital Universitario de Neiva","All","18 Years and older   (Adult, Older Adult)","Phase 2|Phase 3","1600","Other","Interventional","Allocation: Randomized|Intervention Model: Parallel Assignment|Masking: None (Open Label)|Primary Purpose: Treatment","76968","May 11, 2020","October 11, 2020","October 31, 2020","April 24, 2020",,"April 24, 2020","Hospital Universitario de Neiva, Neiva, Huila, Colombia|Clínica Reina Sofía, Bogotá, Colombia|Fundacion Cardio Infantil, Bogotá, Colombia|Hospital Universitario San Ignacio, Bogotá, Colombia|Clinica Universitaria Colombia, Bogotá, Colombia|Hospital Universitario Nacional de Colombia, Bogotá, Colombia",,"https://ClinicalTrials.gov/show/NCT04359095"
44,"NCT04353245","Study of Biomarkers in the Long-term Impact of Coronavirus Infection in the Cardiorespiratory System","PostCOVID19","Not yet recruiting","No Results Available","COVID19|Corona Virus Infection|Myocardial Injury|Pneumonia","Other: BIOMARKERS IN THE LONG TERM IMPACT OF CORONAVIRUS INFECTION IN THE CARDIORRESPIRATORY SYSTEM","Fibrosis|Ergospirometers","University of Sao Paulo General Hospital","All","18 Years and older   (Adult, Older Adult)",,"130","Other","Observational","Observational Model: Case-Control|Time Perspective: Prospective","UAP107","June 1, 2020","September 30, 2021","September 30, 2021","April 20, 2020",,"April 20, 2020","Instituto do Coração - Hospital das Clínicas - Faculdade de Medicina da Universidade de São Paulo, São Paulo, SP, Brazil",,"https://ClinicalTrials.gov/show/NCT04353245"
45,"NCT04334512","A Study of Quintuple Therapy to Treat COVID-19 Infection","HAZDpaC","Not yet recruiting","No Results Available","COVID-19|Corona Virus Infection|Coronavirus-19|Sars-CoV2","Drug: Hydroxychloroquine|Drug: Azithromycin|Dietary Supplement: Vitamin C|Dietary Supplement: Vitamin D|Dietary Supplement: Zinc","The rate of recovery of mild or moderate COVID-19 in patients using Quintuple Therapy|Reduction or Progression of Symptomatic Days|Assess the safety of Quintuple Therapy|Assess the safety of Quintuple Therapy via pulse|Assess the safety of Quintuple Therapy via oxygen saturation|Assess the safety of Quintuple Therapy via EKG|Assess Tolerability of Quintuple Therapy","ProgenaBiome","All","18 Years and older   (Adult, Older Adult)","Phase 2","600","Other","Interventional","Allocation: Randomized|Intervention Model: Parallel Assignment|Masking: Double (Participant, Investigator)|Primary Purpose: Treatment","PRG-044","May 2020","May 2021","August 2021","April 6, 2020",,"May 12, 2020","ProgenaBiome, Ventura, California, United States",,"https://ClinicalTrials.gov/show/NCT04334512"
46,"NCT04351919","Assessment of Efficacy and Safety of HCQ and Antibiotics Administrated to Patients COVID19(+)","COVID+PA","Not yet recruiting","No Results Available","Patients With COVID19","Drug: Hydroxychloroquine|Drug: Azithromycin","improvment or healing of clinical signs|Evolution of clinical signs","Abderrahmane Mami Hospital|Eshmoun Clinical Research Centre|Dacima Consulting","All","18 Years to 80 Years   (Adult, Older Adult)","Phase 4","400","Other","Interventional","Allocation: N/A|Intervention Model: Single Group Assignment|Masking: None (Open Label)|Primary Purpose: Treatment","ECC2020-04","May 5, 2020","July 15, 2020","July 15, 2020","April 17, 2020",,"May 5, 2020","Eshmoun Clinical Research Centre/ Hôpital Abderrahmen Mami-Ariana, Tunis, Tunisia",,"https://ClinicalTrials.gov/show/NCT04351919"
47,"NCT04411433","Efficacy and Safety of Hydroxychloroquine and Favipiravir in the Treatment of Mild to Moderate COVID-19",,"Recruiting","No Results Available","Sars-CoV2|COVID-19","Drug: Favipiravir (3200 mg + 1200 mg)|Drug: Favipiravir (3600 mg + 1600 mg)|Drug: Favipiravir (3200 mg + 1200 mg) combined with Hydroxychloroquine|Drug: Favipiravir (3200 mg + 1200 mg) combined with Azithromycin|Drug: Hydroxychloroquine|Drug: Hydroxychloroquine combined with Azithromycin","Time to recovery (discharge)|Decrease in viral load|Adverse Event (AE), Serious Adverse Event (SAE) and discontinuation of treatment|Frequency of occurrence of lymphopenia from baseline|Frequency of occurrence of thrombocytopenia from baseline|Changes in alanine aminotransferase (ALT) levels from baseline|Changes in aspartate aminotransferase (AST) levels from baseline|Changes in C-reactive protein (CRP) levels from baseline|Changes in level of D-dimer levels from baseline|Changes in prothrombin time (PT) values from baseline|Changes in partial thromboplastin time (PTT) values from baseline|Changes in blood pressure from baseline|Changes in respiratory rate from baseline|Changes in pulse oxymetry from baseline|Changes in fever from baseline","Ministry of Health, Turkey|Hacettepe University, Faculty of Medicine|Prof. Dr. Cemil Tascıoglu Education and Research Hospital Organization|Umraniye Education and Research Hospital|SB Istanbul Education and Research Hospital|Sultan Abdulhamid Han Training and Research Hospital, Istanbul, Turkey|Tepecik Training and Research Hospital|Istanbul University-Cerrahpasa, Cerrahpasa Faculty of Medicine|Ankara University|Ankara City Hospital Bilkent|Ankara Training and Research Hospital|Ege University Hospital (Application and Research Center)|Kocaeli Derince Education and Research Hospital|Istanbul University, Istanbul Faculty of Medicine|Kayseri City Hospital","All","18 Years to 70 Years   (Adult, Older Adult)","Phase 3","1000","Other","Interventional","Allocation: Randomized|Intervention Model: Parallel Assignment|Masking: None (Open Label)|Primary Purpose: Treatment","COVID-19-FAV","May 8, 2020","July 30, 2020","July 30, 2020","June 2, 2020",,"June 2, 2020","Hacettepe University, School of Medicine, Ankara, Turkey",,"https://ClinicalTrials.gov/show/NCT04411433"
48,"NCT04390152","Safety and Efficacy of Intravenous Wharton's Jelly Derived Mesenchymal Stem Cells in Acute Respiratory Distress Syndrome Due to COVID 19",,"Not yet recruiting","No Results Available","Acute Respiratory Distress Syndrome","Drug: Wharton's jelly derived Mesenchymal stem cells.|Drug: Hydroxychloroquine, lopinavir/ritonavir or azithromycin and placebo (standard therapy)","Intergroup mortality difference with treatment|Number of patients with treatment related adverse events|Difference in days of mechanical ventilation between groups|Median reduction of days of hospitalization|Median reduction of days of oxygen needs|Difference between ""Sequential Organ Failure Assessment"" score between groups|Difference between median Murray score between groups|Difference in APACHE II score between groups|Difference in lymphocyte count between groups|Changes in C reactive protein concentration between groups|Changes in D dimer concentration|Changes in ferritin concentration|Changes in lactate dehydrogenase concentration|Impact on interleukin 6 concentrations between groups.|Impact on interleukin 8 concentrations between groups.|Impact on interleukin 10 concentrations between groups.|Impact on tumor necrosis factor alpha concentrations between groups.","BioXcellerator|Clinical Somer","All","18 Years to 80 Years   (Adult, Older Adult)","Phase 1|Phase 2","40","Industry|Other","Interventional","Allocation: Randomized|Intervention Model: Parallel Assignment|Masking: Quadruple (Participant, Care Provider, Investigator, Outcomes Assessor)|Primary Purpose: Treatment","BIOXSOMCOV001","June 2020","November 2020","May 2021","May 15, 2020",,"May 19, 2020","Clinical Somer, Rionegro, Antioquia, Colombia",,"https://ClinicalTrials.gov/show/NCT04390152"
49,"NCT04418193","Patient Preference Trial for COVID-19 (PPT-COVID)","PPT-COVID","Recruiting","No Results Available","Coronavirus",,"Number of death from any cause, or the need for intubation and mechanical ventilation during the 14 days following inclusion and start of treatment.|Number of death from any cause, or the need for intubation and mechanical ventilation during the 28 days following inclusion and start of treatment.|Clinical evolution on the World Health Organisation (WHO) Ordinal Scale for Clinical Improvement (OSCI) for COVID-19 between day 0 and day 14|Clinical evolution on the WHO Ordinal Scale for Clinical Improvement for COVID-19 between day 0 and day 28.|Number of all-cause mortality at day 14|Number of all-cause mortality at day 28|Rate of positive severe acute respiratory syndrome (SARS)-coronavirus 2 (CoV-2) Reverse Transcriptase (RT) - Polymerase Chain Reaction (PCR) on nasopharyngeal samples at day 5|Rate of positive SARS-CoV-2 RT-PCR on nasopharyngeal samples at day 10|The rate of venous thromboembolic events at day 28, documented and confirmed by an adjudication committee.|Number of all-cause mortality at day 28 in patients aged 75 and older|Clinical evolution on the WHO OSCI scale for COVID-19 between day 0 and day 28 for patients aged 75 or older|Rate of severe adverse events at day 28|Number of all-cause mortality at day 14 in patients aged 75 and older","Centre Hospitalier Princesse Grace","All","18 Years to 99 Years   (Adult, Older Adult)",,"100","Other","Observational","Observational Model: Cohort|Time Perspective: Other","20-08","April 6, 2020","September 1, 2020","September 1, 2020","June 5, 2020",,"June 5, 2020","Centre Hospitalier Princesse Grace, Monaco, Monaco",,"https://ClinicalTrials.gov/show/NCT04418193"
50,"NCT04368351","Bacteriotherapy in the Treatment of COVID-19","BACT-ovid","Active, not recruiting","No Results Available","COVID|Pneumonia|Diarrhea","Dietary Supplement: SivoMixx (200 billion)|Drug: Azithromycin|Drug: hydroxychloroquine","delta of time of disappearance of acute diarrhea|Delta in the number of patients requiring orotracheal intubation despite treatment|Delta of crude mortality|Delta of length of stay for patients in hospital","University of Roma La Sapienza","All","18 Years and older   (Adult, Older Adult)",,"70","Other","Observational","Observational Model: Case-Control|Time Perspective: Retrospective","DPHID-UniRoma05","March 1, 2020","June 30, 2020","July 31, 2020","April 29, 2020",,"May 4, 2020","Department of Public Heath and Infectious Diseases. University of Rome ""Sapienza"" (Italy), Rome, Italy",,"https://ClinicalTrials.gov/show/NCT04368351"
51,"NCT04347031","A Study of the Effectiveness of an Off Label Mefloquine Use for the Treatment of Patients With COVID19",,"Active, not recruiting","No Results Available","Pneumonia, Viral|Respiratory Failure","Drug: Mefloquine|Drug: Hydroxychloroquine|Combination Product: Mefloquine + azithromycin + / - tocilizumab|Combination Product: Hydroxychloroquine + azithromycin + / - tocilizumab","1st primary endpoint for group 1|2nd primary endpoint for group 1|1st primary endpoint for group 2|2nd primary endpoint for group 2|1st secondary endpoint for group 1|2nd secondary endpoint for group 1|3d secondary endpoint for group 1|4th secondary endpoint for group 1|5th secondary endpoint for group 1|6th secondary endpoint for group 1|1st secondary endpoint for group 2|2nd secondary endpoint for group 2|3d secondary endpoint for group 2|4th secondary endpoint for group 2|5th secondary endpoint for group 2|6th secondary endpoint for group 2","Burnasyan Federal Medical Biophysical Center","All","18 Years to 60 Years   (Adult)","Phase 2|Phase 3","320","Other","Interventional","Allocation: Randomized|Intervention Model: Parallel Assignment|Masking: None (Open Label)|Primary Purpose: Treatment","FL-01/20","April 8, 2020","August 1, 2020","August 1, 2020","April 15, 2020",,"May 27, 2020","Burnasyan Federal Medical Biophysical Center FMBA of Russia, Moscow, Russian Federation",,"https://ClinicalTrials.gov/show/NCT04347031"
52,"NCT04324463","Anti-Coronavirus Therapies to Prevent Progression of Coronavirus Disease 2019 (COVID-19) Trial","ACT COVID19","Recruiting","No Results Available","Coronavirus|Severe Acute Respiratory Syndrome","Drug: Azithromycin|Drug: Hydoxychloroquine or Chloroquine|Drug: Interferon-Beta","Outpatients: Hospital Admission or Death|Inpatients: Invasive mechanical ventilation or mortality","Population Health Research Institute|Bayer","All","18 Years and older   (Adult, Older Adult)","Phase 3","1500","Other|Industry","Interventional","Allocation: Randomized|Intervention Model: Parallel Assignment|Masking: None (Open Label)|Primary Purpose: Treatment","PHRI.ACT.COVID19","April 21, 2020","September 30, 2020","December 31, 2020","March 27, 2020",,"April 24, 2020","Hamilton Health Sciences, Hamilton, Ontario, Canada",,"https://ClinicalTrials.gov/show/NCT04324463"
53,"NCT04363060","Azithromycin+Amoxicillin/Clavulanate vs Amoxicillin/Clavulanate in COVID19 Patients With Pneumonia in Non-intensive Unit","AziA","Not yet recruiting","No Results Available","COVID-19 Pneumonia","Combination Product: Azithromycin with amoxicillin/clavulanate|Drug: amoxicillin/clavulanate","Rate of positive SARS-CoV-2 RT-PCR|Clinical evolution on the World Health Organization Ordinal Scale for Clinical Improvement for COVID-19|Total duration of antibiotic treatment during the 30 days following inclusion|Number of all-cause mortality during the 30 days following inclusion|Number of in-hospital mortality during the 30 days following inclusion|Number of patients transferred to intensive care unit during the 30-day follow-up|Number of days without mechanical ventilation during the 30 days following inclusion|adverse events attributable to antibiotic treatment during the 30 days following inclusion|Hospital length of stay during the 30 days following inclusion","Nantes University Hospital","All","18 Years to 99 Years   (Adult, Older Adult)","Phase 3","104","Other","Interventional","Allocation: Randomized|Intervention Model: Parallel Assignment|Masking: None (Open Label)|Primary Purpose: Treatment","RC20_0168","April 30, 2020","July 30, 2020","July 30, 2020","April 27, 2020",,"April 29, 2020","Chu Angers, Angers, France|CHD Vendée, La Roche-sur-Yon, France|CHU Poitiers, Poitiers, France",,"https://ClinicalTrials.gov/show/NCT04363060"
54,"NCT04381936","Randomised Evaluation of COVID-19 Therapy","RECOVERY","Recruiting","No Results Available","Severe Acute Respiratory Syndrome","Drug: Lopinavir-Ritonavir|Drug: Corticosteroid|Drug: Hydroxychloroquine|Drug: Azithromycin|Biological: Convalescent plasma|Drug: Tocilizumab","All-cause mortality|Duration of hospital stay|Need for (and duration of) ventilation|Composite endpoint of death or need for mechanical ventilation or ECMO","University of Oxford|UK Research and Innovation|National Institute for Health Research, United Kingdom|Wellcome|Bill and Melinda Gates Foundation|Department for International Development, United Kingdom|Health Data Research UK|Medical Research Council Population Health Research Unit|NIHR Clinical Trials Unit Support Funding","All","Child, Adult, Older Adult","Phase 2|Phase 3","12000","Other","Interventional","Allocation: Randomized|Intervention Model: Factorial Assignment|Masking: None (Open Label)|Primary Purpose: Treatment","NDPHRECOVERY|2020-001113-21|ISRCTN50189673","March 19, 2020","December 2020","June 2021","May 11, 2020",,"June 5, 2020","Nuffield Department of Population Health, University of Oxford, Oxford, United Kingdom",,"https://ClinicalTrials.gov/show/NCT04381936"
55,"NCT04342221","Hydroxychloroquine for COVID-19","COV-HCQ","Recruiting","No Results Available","COVID-19, Hydroxychloroquine Sulfate","Drug: Hydroxychloroquine Sulfate|Drug: Placebo","Effect of HCQ on in vivo viral clearance","University Hospital Tuebingen|Robert Bosch Medical Center|Universitätsklinikum Hamburg-Eppendorf|Bernhard Nocht Institute for Tropical Medicine","All","18 Years to 99 Years   (Adult, Older Adult)","Phase 3","220","Other","Interventional","Allocation: Randomized|Intervention Model: Parallel Assignment|Masking: Quadruple (Participant, Care Provider, Investigator, Outcomes Assessor)|Primary Purpose: Treatment","COV-HCQ|2020-001224-33","March 29, 2020","March 2021","February 2022","April 10, 2020",,"April 10, 2020","Institute for Tropical Medicine, Tübingen, Germany",,"https://ClinicalTrials.gov/show/NCT04342221"
56,"NCT04354428","Treatment for COVID-19 in High-Risk Adult Outpatients",,"Recruiting","No Results Available","COVID-19|SARS-CoV-2","Drug: Ascorbic Acid|Drug: Hydroxychloroquine Sulfate|Drug: Azithromycin|Drug: Folic Acid","Lower respiratory tract infection (LRTI) rates|Incidence of hospitalization or mortality|Change in upper respiratory viral shedding|Rate of participant-reported adverse events","University of Washington|Bill and Melinda Gates Foundation","All","18 Years to 80 Years   (Adult, Older Adult)","Phase 2|Phase 3","630","Other","Interventional","Allocation: Randomized|Intervention Model: Parallel Assignment|Masking: Double (Participant, Investigator)|Primary Purpose: Treatment","STUDY00009878|INV-017062","April 16, 2020","July 2020","October 2020","April 21, 2020",,"May 28, 2020","Ruth M. Rothstein CORE Center - Cook County Health, Chicago, Illinois, United States|Tulane University, New Orleans, Louisiana, United States|Boston University, Boston, Massachusetts, United States|NYU Langone Health, New York, New York, United States|SUNY Upstate Medical University, Syracuse, New York, United States|University of Washington Coordinating Center, Seattle, Washington, United States|UW Virology Research Clinic, Seattle, Washington, United States","""Study Protocol"", https://ClinicalTrials.gov/ProvidedDocs/28/NCT04354428/Prot_000.pdf|""Informed Consent Form"", https://ClinicalTrials.gov/ProvidedDocs/28/NCT04354428/ICF_001.pdf","https://ClinicalTrials.gov/show/NCT04354428"
57,"NCT04350281","Double Therapy With IFN-beta 1b and Hydroxychloroquine",,"Recruiting","No Results Available","COVID","Drug: Interferon Beta-1B|Drug: Hydroxychloroquine","Time to negative NPS viral load|Time to NEWS 0|Length of Hospitalisation|Time to negative viral load in all clinical samples|Adverse events|Mortality|Inflammatory markers changes","The University of Hong Kong","All","18 Years and older   (Adult, Older Adult)","Phase 2","80","Other","Interventional","Allocation: Randomized|Intervention Model: Parallel Assignment|Masking: None (Open Label)|Primary Purpose: Treatment","UW 20-211","April 9, 2020","March 31, 2022","July 31, 2022","April 17, 2020",,"April 17, 2020","The University of Hong Kong, Queen Mary Hospital, Hong Kong, Hong Kong",,"https://ClinicalTrials.gov/show/NCT04350281"
